<!ELEMENT fuhrpark (lkw+)>
<!ELEMENT lkw (hersteller,fahrer+,beschreibung?)>
<!ELEMENT hersteller (#PCDATA)>
<!ELEMENT fahrer (#PCDATA)>
<!ELEMENT beschreibung (#PCDATA)>
<!ATTLIST lkw typ (1|2|3|4|5) #REQUIRED>